Author,Shayari,Tag
FAIZ AHMAD FAIZ,"vahīñ haiñ dil ke qarā.in tamām kahte haiñ 
vo ik ḳhalish ki jise terā naam kahte haiñ 

tum aa rahe ho ki bajtī haiñ merī zanjīreñ 
na jaane kyā mire dīvār-o-bām kahte haiñ 

yahī kanār-e-falak kā siyah-tarīñ gosha 
yahī hai matla-e-māh-e-tamām kahte haiñ 

piyo ki muft lagā dī hai ḳhūn-e-dil kī kashīd 
girāñ hai ab ke mai-e-lāla-fām kahte haiñ 

faqīh-e-shahr se mai kā javāz kyā pūchheñ 
ki chāñdnī ko bhī hazrat harām kahte haiñ 

navā-e-murġh ko kahte haiñ ab ziyān-e-chaman 
khile na phuul ise intizām kahte haiñ 

kaho to ham bhī chaleñ 'faiz' ab nahīñ sar-e-dār 
vo farq-e-martaba-e-ḳhās-o-ām kahte haiñ ",Ghazal
FAIZ AHMAD FAIZ,"ġham-ba-dil shukr-ba-lab mast o ġhazal-ḳhvāñ chaliye 
jab tilak saath tire umr-e-gurezāñ chaliye 

rahmat-e-haq se jo is samt kabhī raah mile 
sū-e-jannat bhī ba-rāh-e-rah-e-jānāñ chaliye 

nazr māñge jo gulistāñ se ḳhudā-vand-e-jahāñ 
sāġhar-e-mai meñ liye ḳhūn-e-bahārāñ chaliye 

jab satāne lage be-rañgi-e-dīvār-e-jahāñ 
naqsh karne koī tasvīr-e-hasīnāñ chaliye 

kuchh bhī ho ā.īna-e-dil ko musaffā rakhiye 
jo bhī guzre masal-e-ḳhusrav-e-daurāñ chaliye 

imtihāñ jab bhī ho manzūr jigar-dāroñ kā 
mahfil-e-yār meñ ham-rāh-e-raqībāñ chaliye ",Ghazal
FAIZ AHMAD FAIZ,"ijz-e-ahl-e-sitam kī baat karo 
ishq ke dam-qadam kī baat karo 

bazm-e-ahl-e-tarab ko sharmāo 
bazm-e-as.hāb-e-ġham kī baat karo 

bazm-e-sarvat ke ḳhush-nashīnoñ se 
azmat-e-chashm-e-nam kī baat karo 

hai vahī baat yuuñ bhī aur yuuñ bhī 
tum sitam yā karam kī baat karo 

ḳhair haiñ ahl-e-dair jaise haiñ 
aap ahl-e-haram kī baat karo 

hijr kī shab to kaT hī jā.egī 
roz-e-vasl-e-sanam kī baat karo 

jaan jā.eñge jānñe vaale 
'faiz' farhād o jam kī baat karo ",Ghazal
FAIZ AHMAD FAIZ,"vo ahd-e-ġham kī kāhish-hā-e-be-hāsil ko kyā samjhe 
jo un kī muḳhtasar rūdād bhī sabr-āzmā samjhe 

yahāñ vābastagī vaañ barhamī kyā jāniye kyuuñ hai 
na ham apnī nazar samjhe na ham un kī adā samjhe 

fareb-e-ārzū kī sahl-añgārī nahīñ jaatī 
ham apne dil kī dhaḌkan ko tirī āvāz-e-pā samjhe 

tumhārī har nazar se munsalik hai rishta-e-hastī 
magar ye duur kī bāteñ koī nādān kyā samjhe 

na pūchho ahd-e-ulfat kī bas ik ḳhvāb-e-pareshāñ thā 
na dil ko raah par laa.e na dil kā mudda.ā samjhe ",Ghazal
FAIZ AHMAD FAIZ,"shafaq kī raakh meñ jal bujh gayā sitāra-e-shām 
shab-e-firāq ke gesū fazā meñ lahrā.e 

koī pukāro ki ik umr hone aa.ī hai 
falak ko qāfila-e-roz-o-shām Thahrā.e 

ye zid hai yaad harīfān-e-bāda-paimā kī 
ki shab ko chāñd na nikle na din ko abr aa.e 

sabā ne phir dar-e-zindāñ pe aa ke dī dastak 
sahar qarīb hai dil se kaho na ghabrā.e ",Ghazal
FAIZ AHMAD FAIZ,"phir ā.īna-e-ālam shāyad ki nikhar jaa.e 
phir apnī nazar shāyad tā-hadd-e-nazar jaa.e 

sahrā pe lage pahre aur qufl paḌe ban par 
ab shahr-badar ho kar dīvāna kidhar jaa.e 

ḳhāk-e-rah-e-jānāñ par kuchh ḳhuuñ thā girau apnā 
is fasl meñ mumkin hai ye qarz utar jaa.e 

dekh aa.eñ chalo ham bhī jis bazm meñ sunte haiñ 
jo ḳhanda-ba-lab aa.e vo ḳhāk-basar jaa.e 

yā ḳhauf se dar-guzreñ yā jaañ se guzar jaa.eñ 
marnā hai ki jiinā hai ik baat Thahar jaa.e ",Ghazal
FAIZ AHMAD FAIZ,"kis harf pe tū ne gosha-e-lab ai jān-e-jahāñ ġhammāz kiyā 
elān-e-junūñ dil vāloñ ne ab ke ba-hazār-andāz kiyā 

sau paikāñ the paivast-e-gulū jab chheḌī shauq kī lai ham ne 
so tiir tarāzū the dil meñ jab ham ne raqs āġhāz kiyā 

be-hirs-o-havā be-ḳhauf-o-ḳhatar is haath pe sar is kaf pe jigar 
yuuñ kū-e-sanam meñ vaqt-e-safar nazzāra-e-bām-e-nāz kiyā 

jis ḳhaak meñ mil kar ḳhaak hue vo surma-e-chashm-e-ḳhalq banī 
jis ḳhaar pe ham ne ḳhuuñ chhiḌkā ham-rañg-e-gul-e-tannāz kiyā 

lo vasl kī saa.at aa pahuñchī phir hukm-e-huzūrī par ham ne 
āñkhoñ ke darīche band kiye aur siine kā dar baaz kiyā ",Ghazal
FAIZ AHMAD FAIZ,"shāḳh par ḳhūn-e-gul ravāñ hai vahī 
shoḳhī-e-rañg-e-gulsitāñ hai vahī 

sar vahī hai to āstāñ hai vahī 
jaañ vahī hai to jān-e-jāñ hai vahī 

ab jahāñ mehrbāñ nahīñ koī 
kūcha-e-yār mehrbāñ hai vahī 

barq sau baar gir ke ḳhaak huī 
raunaq-e-ḳhāk-e-āshiyāñ hai vahī 

aaj kī shab visāl kī shab hai 
dil se har roz dāstāñ hai vahī 

chāñd taare idhar nahīñ aate 
varna zindāñ meñ āsmāñ hai vahī ",Ghazal
FAIZ AHMAD FAIZ,"ye mausam-e-gul garche tarab-ḳhez bahut hai 
ahvāl-e-gul-o-lāla ġham-añgez bahut hai 

ḳhush dāvat-e-yārāñ bhī hai yalġhār-e-adū bhī 
kyā kījiye dil kā jo kam-āmez bahut hai 

yuuñ pīr-e-muġhāñ sheḳh-e-haram se hue yak-jāñ 
mai-ḳhāne meñ kam-zarfi-e-parhez bahut hai 

ik gardan-e-maḳhlūq jo har haal meñ ḳham hai 
ik bāzū-e-qātil hai ki ḳhūñ-rez bahut hai 

kyuuñ mish.al-e-dil 'faiz' chhupāo tah-e-dāmāñ 
bujh jā.egī yuuñ bhī ki havā tez bahut hai ",Ghazal
FAIZ AHMAD FAIZ,"kiye aarzū se paimāñ jo ma.aal tak na pahuñche 
shab-o-roz-e-āshnā.ī mah o saal tak na pahuñche 

vo nazar baham na pahuñchī ki muhīt-e-husn karte 
tirī diid ke vasīle ḳhad-o-ḳhāl tak na pahuñche 

vahī chashma-e-baqā thā jise sab sarāb samjhe 
vahī ḳhvāb mo'tabar the jo ḳhayāl tak na pahuñche 

tirā lutf vaj.h-e-taskīñ na qarār sharh-e-ġham se 
ki haiñ dil meñ vo gile bhī jo malāl tak na pahuñche 

koī yaar jaañ se guzrā koī hosh se na guzrā 
ye nadīm-e-yak-do-sāġhar mire haal tak na pahuñche 

chalo 'faiz' dil jalā.eñ kareñ phir se arz-e-jānāñ 
vo suḳhan jo lab tak aa.e pe savāl tak na pahuñche ",Ghazal
FAIZ AHMAD FAIZ,"phir lauTā hai ḳhurshīd-e-jahāñ-tāb safar se 
phir nūr-e-sahar dast-o-garebāñ hai sahar se 

phir aag bhaḌakne lagī har sāz-e-tarab meñ 
phir sho.ale lapakne lage har dīda-e-tar se 

phir niklā hai dīvāna koī phūñk ke ghar ko 
kuchh kahtī hai har raah har ik rāhguzar se 

vo rañg hai imsāl gulistāñ kī fazā kā 
ojhal huī dīvār-e-qafas hadd-e-nazar se 

sāġhar to khanakte haiñ sharāb aa.e na aa.e 
bādal to garajte haiñ ghaTā barse na barse 

pā-posh kī kyā fikr hai dastār sambhālā 
pāyāb hai jo mauj guzar jā.egī sar se ",Ghazal
FAIZ AHMAD FAIZ,"kis shahr na shohra huā nādānī-e-dil kā 
kis par na khulā raaz pareshānī-e-dil kā 

aao kareñ mahfil pe zar-e-zaḳhm numāyāñ 
charchā hai bahut be-sar-o-sāmānī-e-dil kā 

dekh aa.eñ chalo kū-e-nigārāñ kā ḳharāba 
shāyad koī mahram mile vīrānī-e-dil kā 

pūchho to udhar tīr-fagan kaun hai yaaro 
sauñpā thā jise kaam nigahbānī-e-dil kā 

dekho to kidhar aaj ruḳh-e-bād-e-sabā hai 
kis rah se payām aayā hai zindānī-e-dil kā 

utre the kabhī 'faiz' vo ā.īna-e-dil meñ 
aalam hai vahī aaj bhī hairānī-e-dil kā ",Ghazal
FAIZ AHMAD FAIZ,"yuuñ bahār aa.ī hai is baar ki jaise qāsid 
kūcha-e-yār se be-nail-e-marām aatā hai 

har koī shahr meñ phirtā hai salāmat-dāman 
riñd mai-ḳhāne se shā.ista-ḳhirām aatā hai 

havas-e-mutrib-o-sāqī meñ pareshāñ akasr 
abr aatā hai kabhī māh-e-tamām aatā hai 

shauq vāloñ kī hazīñ mahfil-e-shab meñ ab bhī 
āmad-e-sub.h kī sūrat tirā naam aatā hai 

ab bhī elān-e-sahar kartā huā mast koī 
dāġh-e-dil kar ke farozāñ sar-e-shām aatā hai ",Ghazal
FAIZ AHMAD FAIZ,"jaise ham-bazm haiñ phir yār-e-tarah-dār se ham 
raat milte rahe apne dar-o-dīvār se ham 

sarḳhushī meñ yūñhī dil-shād o ġhazal-ḳhvāñ guzre 
kū-e-qātil se kabhī kūcha-e-dildār se ham 

kabhī manzil kabhī raste ne hameñ saath diyā 
har qadam uljhe rahe qāfila-sālār se ham 

ham se be-bahra huī ab jaras-e-gul kī sadā 
varna vāqif the har ik rañg kī jhankār se ham 

'faiz' jab chāhā jo kuchh chāhā sadā maañg liyā 
haath phailā ke dil-e-be-zar-o-dīnār se ham ",Ghazal
FAIZ AHMAD FAIZ,"sharah-e-bedardi-e-hālāt na hone paa.ī 
ab ke bhī dil kī mudārāt na hone paa.ī 

phir vahī va.ada jo iqrār na banñe paayā 
phir vahī baat jo isbāt na hone paa.ī 

phir vo parvāne jinheñ izn-e-shahādat na milā 
phir vo sham.eñ ki jinheñ raat na hone paa.ī 

phir vahī jāñ-ba-labī lazzat-e-mai se pahle 
phir vo mahfil jo ḳharābāt na hone paa.ī 

phir dam-e-dīd rahe chashm o nazar dīd-talab 
phir shab-e-vasl mulāqāt na hone paa.ī 

phir vahāñ bāb-e-asar jāniye kab band huā 
phir yahāñ ḳhatm munājāt na hone paa.ī 

'faiz' sar par jo har ik roz qayāmat guzrī 
ek bhī roz mukāfāt na hone paa.ī ",Ghazal
FAIZ AHMAD FAIZ,"yak-ba-yak shorish-e-fuġhāñ kī tarah 
fasl-e-gul aa.ī imtihāñ kī tarah 

sehn-e-gulshan meñ bahr-e-mushtāqāñ 
har ravish khiñch ga.ī kamāñ kī tarah 

phir lahū se har ek kāsa-e-dāġh 
pur huā jām-e-arġhavāñ kī tarah 

yaad aayā junūn-e-gum-gashta 
be-talab qarz-e-dostāñ kī tarah 

jaane kis par ho mehrbāñ qātil 
be-sabab marg-e-nā-gahāñ kī tarah 

har sadā par lage haiñ kaan yahāñ 
dil sambhāle raho zabāñ kī tarah ",Ghazal
FAIZ AHMAD FAIZ,"qand-e-dahan kuchh is se ziyāda 
lutf-e-suḳhan kuchh is se ziyāda 

fasl-e-ḳhizāñ meñ lutf-e-bahārāñ 
barg-e-saman kuchh is se ziyāda 

hāl-e-chaman par talḳh-navā.ī 
murġh-e-chaman kuchh is se ziyāda 

dil-shikanī bhī dildārī bhī 
yād-e-vatan kuchh is se ziyāda 

sham-e-badan fānūs-e-qabā meñ 
ḳhūbī-e-tan kuchh is se ziyāda 

ishq meñ kyā hai ġham ke alāva 
ḳhvāja-e-man kuchh is se ziyāda ",Ghazal
